{
  "schemaVersion": "1.0.0",
  "catalogId": "sample-cots-001",
  "meta": {
    "name": "Sample COTS Catalog",
    "description": "Sample catalog of commercial off-the-shelf sUAS components for training and demonstration",
    "unit": "Sample Unit",
    "lastUpdated": "2026-01-07T00:00:00Z",
    "inventoryReference": "SAMPLE-CATALOG-001"
  },
  "airframes": [
    {
      "id": "frame-001",
      "name": "5\" Freestyle Frame",
      "type": "multi-rotor",
      "weight_g": 85,
      "max_payload_g": 400,
      "motor_count": 4,
      "motor_size": "2207",
      "prop_size": "5x4.3",
      "material": "carbon fiber",
      "printable": false,
      "manufacturer": "Generic",
      "part_number": "FRM-5IN-001",
      "cost_usd": 45.00,
      "availability": "in-stock",
      "notes": "Standard 5-inch racing/freestyle frame",
      "tags": ["multi-rotor", "racing", "freestyle"]
    },
    {
      "id": "frame-002",
      "name": "7\" Long Range Frame",
      "type": "multi-rotor",
      "weight_g": 145,
      "max_payload_g": 800,
      "motor_count": 4,
      "motor_size": "2806",
      "prop_size": "7x3.5",
      "material": "carbon fiber",
      "printable": false,
      "manufacturer": "Generic",
      "part_number": "FRM-7IN-001",
      "cost_usd": 68.00,
      "availability": "in-stock",
      "notes": "Long-range 7-inch frame for extended flight times",
      "tags": ["multi-rotor", "long-range", "endurance"]
    },
    {
      "id": "frame-003",
      "name": "Fixed-Wing Raptor 660mm",
      "type": "fixed-wing",
      "weight_g": 180,
      "max_payload_g": 500,
      "motor_count": 1,
      "motor_size": "2212",
      "prop_size": "9x6",
      "material": "EPO foam",
      "printable": false,
      "manufacturer": "Generic",
      "part_number": "FW-RAPTOR-660",
      "cost_usd": 89.00,
      "availability": "in-stock",
      "notes": "Small fixed-wing platform for extended range missions",
      "tags": ["fixed-wing", "long-range", "recon"]
    },
    {
      "id": "frame-004",
      "name": "3D-Printed VTOL Frame",
      "type": "vtol",
      "weight_g": 220,
      "max_payload_g": 600,
      "motor_count": 5,
      "motor_size": "2207",
      "prop_size": "5x4.3",
      "material": "3D-printed PLA",
      "printable": true,
      "stl_file": "files/vtol_frame_v2.stl",
      "manufacturer": "Community Design",
      "part_number": "VTOL-PRINT-001",
      "cost_usd": 15.00,
      "availability": "in-stock",
      "notes": "Locally manufacturable VTOL frame for partner forces",
      "tags": ["vtol", "3d-printed", "partner-forces"]
    }
  ],
  "motors": [
    {
      "id": "motor-001",
      "name": "2207 1800KV Motor",
      "size": "2207",
      "kv": 1800,
      "weight_g": 31,
      "max_current_a": 32,
      "max_power_w": 420,
      "max_thrust_g": 1350,
      "voltage_range": {"min_v": 14.8, "max_v": 22.2},
      "prop_size_range": "5-6 inch",
      "manufacturer": "T-Motor",
      "part_number": "TM-2207-1800",
      "cost_usd": 24.99,
      "availability": "in-stock",
      "notes": "Efficient 5-inch motor for freestyle and racing",
      "tags": ["multi-rotor", "efficient", "5-inch"]
    },
    {
      "id": "motor-002",
      "name": "2806 1300KV Motor",
      "size": "2806",
      "kv": 1300,
      "weight_g": 42,
      "max_current_a": 40,
      "max_power_w": 520,
      "max_thrust_g": 1850,
      "voltage_range": {"min_v": 14.8, "max_v": 22.2},
      "prop_size_range": "6-7 inch",
      "manufacturer": "iFlight",
      "part_number": "IF-2806-1300",
      "cost_usd": 28.50,
      "availability": "in-stock",
      "notes": "Long-range motor optimized for 7-inch props",
      "tags": ["multi-rotor", "long-range", "7-inch"]
    },
    {
      "id": "motor-003",
      "name": "2212 920KV Motor",
      "size": "2212",
      "kv": 920,
      "weight_g": 58,
      "max_current_a": 28,
      "max_power_w": 350,
      "max_thrust_g": 1100,
      "voltage_range": {"min_v": 11.1, "max_v": 14.8},
      "prop_size_range": "9-10 inch",
      "manufacturer": "SunnySky",
      "part_number": "SS-2212-920",
      "cost_usd": 19.99,
      "availability": "in-stock",
      "notes": "Fixed-wing motor for efficient cruise",
      "tags": ["fixed-wing", "efficient"]
    }
  ],
  "escs": [
    {
      "id": "esc-001",
      "name": "4-in-1 ESC 45A",
      "max_current_a": 45,
      "weight_g": 28,
      "voltage_range": {"min_v": 14.8, "max_v": 25.2},
      "firmware": "BLHeli_32",
      "protocols": ["DShot600", "DShot300", "PWM"],
      "integrated": true,
      "manufacturer": "Holybro",
      "part_number": "HB-45A-4IN1",
      "cost_usd": 54.99,
      "availability": "in-stock",
      "notes": "Integrated 4-in-1 ESC for multi-rotor",
      "tags": ["multi-rotor", "blheli32", "4-in-1"]
    },
    {
      "id": "esc-002",
      "name": "Single ESC 60A",
      "max_current_a": 60,
      "weight_g": 14,
      "voltage_range": {"min_v": 7.4, "max_v": 25.2},
      "firmware": "SimonK",
      "protocols": ["PWM", "OneShot"],
      "integrated": false,
      "manufacturer": "HobbyWing",
      "part_number": "HW-60A",
      "cost_usd": 22.99,
      "availability": "in-stock",
      "notes": "Single ESC for fixed-wing or single-motor builds",
      "tags": ["fixed-wing", "single-motor"]
    }
  ],
  "batteries": [
    {
      "id": "battery-001",
      "name": "4S 1500mAh 100C",
      "chemistry": "LiPo",
      "cells": 4,
      "voltage_nominal_v": 14.8,
      "capacity_mah": 1500,
      "capacity_wh": 22.2,
      "weight_g": 180,
      "c_rating": 100,
      "max_discharge_a": 150,
      "connector_type": "XT60",
      "dimensions_mm": {"length": 80, "width": 35, "height": 30},
      "temperature_range_c": {"min": -10, "max": 60},
      "manufacturer": "CNHL",
      "part_number": "CNHL-4S-1500-100",
      "cost_usd": 28.99,
      "availability": "in-stock",
      "notes": "High-discharge racing battery",
      "tags": ["racing", "high-discharge", "4s"]
    },
    {
      "id": "battery-002",
      "name": "4S 3000mAh 50C",
      "chemistry": "LiPo",
      "cells": 4,
      "voltage_nominal_v": 14.8,
      "capacity_mah": 3000,
      "capacity_wh": 44.4,
      "weight_g": 295,
      "c_rating": 50,
      "max_discharge_a": 150,
      "connector_type": "XT60",
      "dimensions_mm": {"length": 120, "width": 42, "height": 32},
      "temperature_range_c": {"min": -10, "max": 60},
      "manufacturer": "Tattu",
      "part_number": "TATTU-4S-3000-50",
      "cost_usd": 45.99,
      "availability": "in-stock",
      "notes": "Long-range battery for extended flight times",
      "tags": ["long-range", "endurance", "4s"]
    },
    {
      "id": "battery-003",
      "name": "6S 4500mAh 35C",
      "chemistry": "LiPo",
      "cells": 6,
      "voltage_nominal_v": 22.2,
      "capacity_mah": 4500,
      "capacity_wh": 99.9,
      "weight_g": 520,
      "c_rating": 35,
      "max_discharge_a": 157,
      "connector_type": "XT90",
      "dimensions_mm": {"length": 155, "width": 48, "height": 48},
      "temperature_range_c": {"min": -10, "max": 60},
      "manufacturer": "Gens Ace",
      "part_number": "GA-6S-4500-35",
      "cost_usd": 89.99,
      "availability": "in-stock",
      "notes": "High-capacity 6S battery for heavy-lift or long-endurance",
      "tags": ["long-range", "heavy-lift", "6s"]
    },
    {
      "id": "battery-004",
      "name": "3S 2200mAh Li-ion",
      "chemistry": "Li-ion",
      "cells": 3,
      "voltage_nominal_v": 11.1,
      "capacity_mah": 2200,
      "capacity_wh": 24.4,
      "weight_g": 135,
      "c_rating": 10,
      "max_discharge_a": 22,
      "connector_type": "XT30",
      "dimensions_mm": {"length": 100, "width": 35, "height": 18},
      "temperature_range_c": {"min": -20, "max": 60},
      "manufacturer": "Samsung",
      "part_number": "SAMS-3S-2200-LI",
      "cost_usd": 32.99,
      "availability": "in-stock",
      "notes": "Li-ion battery for endurance missions, better cold performance",
      "tags": ["endurance", "cold-weather", "li-ion"]
    }
  ],
  "flight_controllers": [
    {
      "id": "fc-001",
      "name": "F7 Flight Controller",
      "weight_g": 8,
      "processor": "STM32F722",
      "firmware": ["Betaflight", "INAV"],
      "gyro": "MPU6000",
      "voltage_input_v": {"min": 4.5, "max": 26},
      "current_draw_ma": 150,
      "uart_ports": 6,
      "features": ["GPS", "Barometer", "OSD", "Blackbox"],
      "manufacturer": "Matek",
      "part_number": "MATEK-F722",
      "cost_usd": 39.99,
      "availability": "in-stock",
      "notes": "Feature-rich F7 FC with built-in OSD",
      "tags": ["f7", "osd", "gps"]
    },
    {
      "id": "fc-002",
      "name": "Pixhawk 4 Mini",
      "weight_g": 37,
      "processor": "STM32F765",
      "firmware": ["PX4", "ArduPilot"],
      "gyro": "ICM-20689",
      "voltage_input_v": {"min": 4.8, "max": 5.5},
      "current_draw_ma": 300,
      "uart_ports": 4,
      "features": ["GPS", "Barometer", "Magnetometer", "SD Card"],
      "manufacturer": "Holybro",
      "part_number": "HB-PX4-MINI",
      "cost_usd": 99.00,
      "availability": "in-stock",
      "notes": "Professional-grade autopilot for autonomous missions",
      "tags": ["autopilot", "autonomous", "px4"]
    }
  ],
  "radios": [
    {
      "id": "radio-001",
      "name": "ELRS 2.4GHz RX",
      "type": "control",
      "frequency_band": "2.4GHz",
      "frequency_range_mhz": {"min": 2400, "max": 2483},
      "weight_g": 3,
      "power_output_mw": 100,
      "power_consumption_w": 0.5,
      "range_m": 30000,
      "data_rate_kbps": 250,
      "antenna_connector": "U.FL",
      "protocols": ["CRSF", "ELRS"],
      "voltage_input_v": {"min": 3.3, "max": 5.5},
      "manufacturer": "HappyModel",
      "part_number": "HM-ELRS-RX",
      "cost_usd": 12.99,
      "availability": "in-stock",
      "notes": "Long-range control link with ExpressLRS",
      "tags": ["elrs", "long-range", "control"]
    },
    {
      "id": "radio-002",